sentence,sentiment,positive_score,negative_score,neutral_score
The European Commission also proposed to extend two other emergency regulations.,neutral,0.13990149,0.051626787,0.80847174
The first concerns Regulation (EU) 2022/2578 on the market-correction mechanism for gas.,neutral,0.034313176,0.018063659,0.9476232
The regulation introduces a sort of pressure relief valve to protect the economy from excessively high prices.,neutral,0.16589853,0.020645393,0.81345606
"The second concerns the emergency regulation on permit-granting procedures (EU) 2022/2577, which introduces simplified rules for the granting of permits in order to accelerate the expansion of renewables and associated network infrastructure.",neutral,0.053078216,0.020252272,0.9266695
"The measures it contains are also contained in the amended Renewable Energy Directive (“RED”) and, after the emergency regulation’s expiration, will therefore become permanent.",neutral,0.026372671,0.023690864,0.9499365
The European Council approved the European Commission’s proposals on extending the emergency regulations.,positive,0.75387686,0.022822073,0.22330105
"The European Commission published a proposal on March 16, 2023, to amend the directive and regulation on the European internal power market.",neutral,0.100316174,0.017480433,0.88220334
"The changes to the power market design aim to (i) introduce long-term stimulus for new investments (such as through bilateral agreements for differences and power price agreements), (ii) protect consumers (such as by means of certain price regulation requirements in times of crisis), and (iii) introduce new regulatory requirements to further promote flexibility.",positive,0.5229184,0.008965017,0.46811655
The European Council and the European Parliament adopted their respective negotiating positions during the year and reached an agreement on December 14.,positive,0.86140925,0.013521034,0.12506971
The new power market design is supposed to take effect and be further implemented in 2024.,neutral,0.17521974,0.0075599016,0.8172204
"In addition, numerous measures to accelerate renewables expansion and the decarbonization of industry in the EU were initiated or continued.",positive,0.7826597,0.0074270666,0.20991315
"The Net Zero Industry Act (“NZIA”) aims, for example, to support the production of technologies that are decisive for the achievement of climate neutrality.",positive,0.6090321,0.008128353,0.38283962
The NZIA is intended to simplify the legal framework for the manufacture of these technologies and thus to enhance the competitiveness of Europe’s net-zero technology industry.,positive,0.8274382,0.006958816,0.16560294
"In addition, the delegated regulations on green hydrogen— (EU) 2023/1184 and (EU) 2023/1185— were published in the Official Journal of the European Union on June 20, 2023.",neutral,0.03854948,0.017255373,0.9441951
"The first regulation establishes three conditions (additionality, temporal correlation, and geographical correlation between an electrolyser and the installation generating renewable energy for it) and exceptions, under which hydrogen-based fuels can be classified as renewable fuels of nonbiological origin (“RFNBO”).",neutral,0.045262236,0.01671723,0.9380205
The second regulation contains a method for calculating RFNBO’s life cycle greenhouse gas emissions.,neutral,0.045780763,0.014986595,0.93923265
"Directive (EU) 2023/2413 on support for energy from renewable sources was published on October 18, 2023.",neutral,0.045414884,0.015781546,0.93880355
It introduces a new minimum of 42.5 percent for energy renewables’ share of the EU’s gross energy consumption as well as sector targets.,neutral,0.21596546,0.011351298,0.77268326
"Furthermore, member states must establish requirements for accelerating approvals processes for renewables facilities and for network expansion.",neutral,0.32131702,0.010841371,0.6678417
"In addition, the European Council and the European Parliament agreed on a gas package.",positive,0.87280643,0.012744147,0.114449464
"In particular, the new EU gas directive updates consumer-protection mechanisms for gas customers and adjusts the modalities of network access and network planning to reflect the current context, which is characterized by increased use of low-carbon gases.",neutral,0.36848402,0.009498563,0.6220174
"In the future, a distinction is to be made between, and different rules established for, hydrogen distribution system operators (“DSOs”) and hydrogen transmission system operators (“TSOs”).",neutral,0.039652947,0.021097912,0.93924916
The (vertical) unbundling rules require infrastructure to be separated from competitive activities in a way that is similar to existing unbundling rules for gas.,neutral,0.03873464,0.019061442,0.9422039
"Consequently, less strict rules will apply to DSOs for hydrogen as well.",neutral,0.04095068,0.021872737,0.93717664
"In addition, only gas and hydrogen TSOs will have to operate as legally separate network companies.",neutral,0.025408106,0.022271102,0.95232075
"Exceptions are possible at the national level, however, for TSOs that submit a cost-benefit analysis that is confirmed by their national regulatory agency.",neutral,0.030285036,0.027186362,0.94252855
DSOs will be exempted from horizontal unbundling.,neutral,0.022614446,0.04893249,0.9284531
"Combined Group Management Report Contents Search Back → About this Report → Corporate Profile → Climate Protection and Environmental Management → Employees and Society → Governance → Sustainable Finance → Business Report → Forecast Report → Risks and Chances Report → Internal Control System → Disclosures Regarding Takeovers 71 E.ON SE Financial Statements 2023 On November 14, 2023, the European Council and the European Parliament reached an agreement on a methane emissions regulation.",positive,0.68780464,0.012642606,0.29955268
"In particular, the regulation introduces new obligations for gas infrastructure operators to conduct periodic checks to detect and eliminate leaks, to identify the sources of methane emissions, and to repair or replace the components in question.",neutral,0.18642955,0.025758969,0.78781146
"The Commission must, within 12 months, issue an implementing act that specifies minimum detection limits.",neutral,0.065328956,0.01833678,0.9163343
"In addition, the new EU Directive 2023/1791 on energy efficiency was published on September 13, 2023.",neutral,0.06308027,0.013099495,0.9238202
It contains ambitious targets for reducing the EU’s energy consumption by at least 11.7 percent by 2030 relative to the EU reference scenario.,positive,0.618248,0.025736894,0.35601518
Member states must stipulate their respective contribution and achieve new annual energy savings that gradually increase to 1.9 percent by 2030.,positive,0.9025877,0.010377432,0.08703489
"On December 7, 2023, the European Council and European Parliament reached an agreement on revising the energy performance of buildings directive, which introduces new requirements for decarbonizing buildings, including ambitious targets for the availability of charging infrastructure for electric vehicles and for readiness for zero-emissions buildings.",positive,0.86129814,0.01037741,0.12832443
"The European Commission published an EU Grid Action Plan on November 29, 2023.",neutral,0.086733215,0.013527808,0.8997389
The plan is a non-legislative announcement that outlines additional strategic initiatives to foster the modernization of power networks and thus to support Europe’s climate-protection and renewables targets.,positive,0.89329386,0.008490783,0.098215386
The initiative’s principle aim is to simplify the funding and approval of network modernization.,positive,0.5868608,0.007844943,0.4052943
Germany In mid-2022 the Bundestag passed the Easter package to accelerate renewables expansion.,positive,0.7803882,0.010929761,0.20868203
"It amended a variety of legislation, such as the Renewable Energy Sources Act (German abbreviation: EEG), to increase the target for the proportion of renewable energy in gross power consumption from 50 percent to 80 percent by 2030.",positive,0.86427605,0.010134878,0.12558915
The focus is on expanding solar energy.,neutral,0.19806397,0.0071010315,0.79483503
"Compared with the previous target of 100 GW for 2030, installed photovoltaic capacity is to be more than doubled to over 215 GW, and onshore wind capacity is to be increased from 71 GW to 115 GW.",positive,0.9368995,0.01070256,0.052397978
In 2023 the annual target of 9 GW net additions to photovoltaic capacity was already met in September.,positive,0.81723547,0.009709534,0.17305495
"At the end of the third quarter of 2023, additions to onshore wind capacity amounted to around 50 percent of the annual target of 3.9 GW.",positive,0.667414,0.013343863,0.3192421
The number of requests for new network connections for feed-in systems has increased considerably in recent years.,positive,0.922721,0.01291527,0.064363666
"In view of the above-described accelerated implementation of climate-protection efforts, this figure is likely to continue to rise sharply.",positive,0.94211215,0.030533485,0.027354332
"For example, the number of PV requests received by E.ON power distribution system operators doubled from around 120,000 in 2021 to about 240,000 in 2022.",positive,0.93979025,0.021957228,0.03825254
"Requests increased a further 70 percent to about 400,000 in 2023.",positive,0.9305812,0.011861697,0.05755711
"Additional measures for standardization, digitalization, and automation of network connection processes are necessary to enable network connection requests to be processed in a timely manner.",neutral,0.12757881,0.010722883,0.8616983
"In line with its corporate strategy, E.ON endorses the German federal government’s initiatives to accelerate renewables expansion.",positive,0.7352168,0.006940009,0.2578433
We also support accelerated renewables growth by the necessary expansion of our smart distribution networks.,positive,0.92373854,0.009138624,0.06712289
The significant increase in momentum and the resulting need for additional investments reinforce E.ON’s growth strategy.,positive,0.71428496,0.23358051,0.052134577
The Forecast Report describes our investment plans in particular for 2024.,neutral,0.05329157,0.0142516885,0.9324567
"To achieve policymakers’ expansion targets, the mechanisms for accelerating planning and approval procedures in particular must also have an impact, and the additional measures from the Pact for Accelerating Planning, Approval, and Implementation between the federal and state governments from early November 2023 must be implemented promptly.",neutral,0.17961553,0.011836424,0.8085481
The German federal government took steps to accelerate the rollout of smart energy meters by adopting the Metering Point Operation Act (German abbreviation: MsbG).,positive,0.8513873,0.0084738815,0.14013879
"The MsbG, which was amended by the Act on the Restart of the Digitalization of the Energy Transition, establishes a timetable with binding targets through 2030.",neutral,0.17779301,0.0115214605,0.8106855
Metering point operators are obliged to successively equip connected consumption points with smart metering systems.,neutral,0.13131544,0.008574629,0.86011
The law took effect in May 2023.,neutral,0.03540212,0.018407864,0.94618994
"The amended Section 14a of the Energy Industry Act (German abbreviation: EnWG) stipulates that, in the future, controllable consumption devices like electric heat pumps and wallboxes for electric cars are be controlled on a network-oriented basis and, in return, are to receive network fee reductions.",neutral,0.17421126,0.10141749,0.72437125
"This mechanism does not replace the upgrading of distribution networks, but supplements it temporarily.",neutral,0.06435844,0.014719201,0.92092234
In late November 2023 the Federal Network Agency (German abbreviation: BNetzA) adopted a corresponding regulation.,neutral,0.06843932,0.014516037,0.91704464
In June 2023 the German federal government also initiated the amendment of the Climate Protection Act.,neutral,0.17834654,0.011886278,0.8097672
"Originally, the Climate Protection Act provided for annual emissions reduction targets for the energy, industry, transport, buildings, agriculture, and waste- management sectors.",neutral,0.1431081,0.016683294,0.84020865
"The current amendment stipulates, among other things, that climate targets are to be met on a forward- looking, multiyear, and cross-sector basis rather than retroactively by sector.",neutral,0.07971181,0.013867396,0.90642077
Emissions reduction targets for individual sectors are therefore to be eliminated.,neutral,0.060469314,0.025744285,0.91378635
"The need to completely convert the power sector to renewables in a short space of time and to make this conversion efficient, secure, and fast requires the modification of Germany’s power market design.",neutral,0.18760835,0.010079566,0.80231214
"For this reason, in 2023 the Federal Ministry for Economic Affairs and Climate Protection launched the Platform for a Climate-Neutral Power System to serve as a discussion forum on the future design of the power market.",neutral,0.39000022,0.007904629,0.60209507
"Stakeholders from parliament, the European Commission, science, business, and civil society are involved.",neutral,0.07218678,0.011112838,0.9167004
"In order to achieve the goal of fully decarbonizing the heat supply by 2045, the Building Energy Act, which aims to convert heating Combined Group Management Report Contents Search Back → About this Report → Corporate Profile → Climate Protection and Environmental Management → Employees and Society → Governance → Sustainable Finance → Business Report → Forecast Report → Risks and Chances Report → Internal Control System → Disclosures Regarding Takeovers 72 E.ON SE Financial Statements 2023 technologies, and the Heat Planning Act, which addresses heating networks and forms the basis for municipal heat planning, were passed in 2023.",neutral,0.07091621,0.013247246,0.9158366
"The Building Energy Act stipulates that, in the future, new heating systems may only be installed if at least 65 percent of the heat they generate comes from renewable sources.",neutral,0.07432978,0.013698356,0.91197187
"This applies to new buildings from January 2024 onward, with transitional periods through 2028 for existing buildings.",neutral,0.030832037,0.021560062,0.9476079
"The regulations are accompanied by, among other things, income- dependent subsidies.",neutral,0.037356175,0.020125698,0.9425181
The Heating Planning Act initially foresees that 30 percent of the heat in existing heating networks is to be renewable.,neutral,0.06999784,0.011053516,0.91894865
"At the same time, the federal states are obliged to work toward ensuring that local authorities draw up heating plans by 2028 at the latest.",neutral,0.33680958,0.014434429,0.64875597
The plans specify which areas are to be supplied with distributed or district heating and how renewable energy and waste heat can be used.,neutral,0.040731333,0.013529204,0.9457395
"How the methane emissions regulation adopted by the EU will affect gas networks cannot yet be fully assessed, because the specific requirements for gas network operators have not yet been conclusively defined.",neutral,0.023221485,0.069512635,0.9072659
The Energy Industry Act (German abbreviation: EnWG) was amended several times in 2023.,neutral,0.054104682,0.039818536,0.90607685
"Various topics were addressed, in particular the implementation of the ECJ’s ruling on the independence of the Federal Network Agency (German abbreviation: BNetzA) and the development of a hydrogen core grid, including its financing.",neutral,0.09441038,0.011530799,0.8940588
"Central to the implementation of the ECJ ruling is the formal upgrading of the BNetzA, which is now solely responsible for setting the conditions for network access and network fees (power, gas, hydrogen).",neutral,0.1547705,0.008514879,0.8367146
"In a motion for a resolution passed parallel to the main EnWG amendment, it was announced that additional regulations for networks connection are anticipated.",neutral,0.16016017,0.012210117,0.8276297
"Following the latest cost review, the BNetzA confirmed the cost basis of E.ON’s distribution network operating companies for the fourth regulatory period for power, although the final determinations are still pending and are expected in the first quarter of 2024.",neutral,0.084573515,0.024103409,0.8913231
"In 2023 the BNetzA also set some of the important regulatory parameters for the fourth regulatory period (2023 to 2027 for gas, 2024 to 2028 for power).",neutral,0.056944802,0.016909622,0.92614555
"During the year the BNetzA, among other things, announced an increase in the interest rates for the cost of debt and cost of equity component of the capital cost surcharge for new investments in power and gas networks from 2024 onward.",positive,0.8266412,0.009899012,0.16345978
This is intended to take account of current interest-rate developments and also to provide incentives for new investments in network expansion to propel the energy transition.,positive,0.7587332,0.006491677,0.23477516
"However, these determinations only represent temporary regulations that are limited to the duration of the fourth regulatory period.",neutral,0.020562543,0.098100506,0.8813369
"E.ON’s distribution network operating companies filed an appeal to the capital cost of debt part within the capital cost surcharge for new investments in power and gas networks from 2024 onward with the aim of extending the regulation to 2023, in particular in order to take sufficient account of the development of interest rates for cost of debt in 2023.",neutral,0.23498502,0.016346581,0.74866843
"In addition, E.ON’s network operators are considering whether to file a similar objection to the equity portion.",neutral,0.031549428,0.43522415,0.53322643
"However, some important regulatory parameters for the fourth regulatory period— for example, the general and individual productivity factors for gas and power— have not yet been finalized or are still under discussion or consultation with the BNetzA.",neutral,0.031000352,0.036169287,0.9328304
"The determination of the regulatory return on equity (known as the cost of equity I interest rate) for the fourth regulatory period is also not yet legally binding, because the BNetzA has filed an appeal with the Federal Court of Justice (German abbreviation: BGH) against a ruling issued in August 2023 by the Düsseldorf Higher Regional Court, which had ruled in favor of network operators in their first appeal in their original lawsuit.",negative,0.051886722,0.49840465,0.44970858
A ruling by the BGH is expected some time in 2024.,neutral,0.046136815,0.15038493,0.80347824
"As announced, the BNetzA is planning a review of the current regulatory framework with regard to the rapidly increasing demands placed on network operators by the energy and climate transition.",neutral,0.34997094,0.028495494,0.6215336
In early 2024 the BNetzA published a white paper containing initial proposals and presented it to energy-industry representatives and other stakeholders.,neutral,0.1131564,0.010756515,0.87608707
"The white paper focuses on refinements to the regulatory framework for the fifth regulatory period (for gas from 2028 onward, for power from 2029 onward) for DSOs and gas TSOs, as well as the need for short-term adjustments to gas networks’ useful operating lifetimes.",neutral,0.1170627,0.011058253,0.87187904
The BNetzA has planned a discussion process that will last until the end of 2025.,neutral,0.06019802,0.014739561,0.92506236
Existing laws will continue to apply until further notice.,neutral,0.036530845,0.018947927,0.9445213
Actual changes for network operators will only arise when the results are codified into a formally binding legal framework.,neutral,0.08731036,0.0102138175,0.9024759
"With regard to the white paper for the fifth regulatory period, this is expected to take place in 2026.",neutral,0.039736398,0.016242478,0.94402117
Regulations were established for a core network for hydrogen.,neutral,0.26524848,0.008641632,0.72610986
"It is to be about 10,000 kilometers long and initially serve for transport and supply to large customers.",neutral,0.10460216,0.008221659,0.88717616
The core network was planned alongside the legislative process and is expected to be approved by the Federal Network Agency in the first quarter of 2024 so that pipelines can be built in a timely manner.,neutral,0.42186326,0.008663214,0.5694735
State protection (using the amortization approach) is planned for the investments of network operators in the core network.,neutral,0.09262251,0.008829868,0.89854765
Considerable efforts in all legal and economic areas remain necessary for Germany to achieve its expansion targets for photovoltaics.,positive,0.90624285,0.009422064,0.08433511
Amendments to the Renewable Energy Sources Act (German abbreviation: EEG) in particular are intended to pave the way for achieving the expansion targets defined in EEG 2023 in a way that is compatible with the energy system as a whole.,positive,0.8132329,0.0073490487,0.17941807
"The German federal government intends for the draft legislation to reconfigure the subsizes for special solar systems (agri PV, floating PV, moor PV, and parking PV), facilitate the expansion of rooftop photovoltaic systems, simplify tenant-produced power, and enable the communal supply of buildings.",positive,0.7465903,0.007456279,0.24595344
It also aims to facilitate plug-in solar systems and accelerate grid connection.,positive,0.52738476,0.0071063233,0.46550888
"As relief for gas and heat customers, a reduced VAT on gas and heat deliveries applied in 2023.",positive,0.7216475,0.019379947,0.25897256
"It expires on March 31, 2024.",neutral,0.015564077,0.061034184,0.9234017
"On November 15, 2023, the Federal Constitutional Court ruled that the law on the second supplementary budget for 2021 is unconstitutional.",negative,0.024440635,0.85111076,0.12444861
The ruling directly affects the Climate and Combined Group Management Report Contents Search Back → About this Report → Corporate Profile → Climate Protection and Environmental Management → Employees and Society → Governance → Sustainable Finance → Business Report → Forecast Report → Risks and Chances Report → Internal Control System → Disclosures Regarding Takeovers 73 E.ON SE Financial Statements 2023 Transformation Fund (German abbreviation: KTF).,neutral,0.017256701,0.05433555,0.9284078
"If the ruling’s principles are applied to the other special funds, the Economic Stabilization Fund (German abbreviation: WSF) is also indirectly affected.",neutral,0.023136342,0.18865027,0.7882134
"As a result, the German government did not, as planned, extend state funding by means of power and gas price caps until the end of March 2024; instead, they expired at the end of 2023.",neutral,0.047637053,0.1224006,0.8299624
"In terms of (cyber) security, Germany’s implementation of the resilience of critical entities directive (“CER Directive”), the measures for high common level of cyber security (“NIS2 Directive”), the European Commission’s network code on cybersecurity focused on avoiding unnecessary bureaucracy and double regulation.",neutral,0.089203894,0.019155152,0.89164096
E.ON has largely implemented the planned security measures.,positive,0.56445813,0.010772318,0.42476958
United Kingdom The U.K. government provided billions of pounds of financial support to help households and businesses cope with the worst effects of high wholesale prices in the first quarter of 2023.,positive,0.9035095,0.01609535,0.08039513
"Wholesale energy prices have since fallen from their peak, but bills are still almost double what they were before the energy crisis.",negative,0.013849464,0.9615625,0.024588026
"Energy affordability remains a key policy concern, as some customers are finding it increasingly difficult to bear the costs.",negative,0.10939654,0.7634211,0.12718232
"In response, a winter subsidy was introduced.",neutral,0.44355828,0.042780157,0.5136616
"Despite the challenges of energy affordability, the U.K. government remains committed to its net-zero emissions target and increased subsidies in some areas, such as heat pumps, by 50 percent to accelerate adoption.",positive,0.9257863,0.011637692,0.06257602
"In other areas, however, the pace of change slowed slightly, as evidenced by the recent decision to postpone the ban on the sale of new gasoline and diesel cars by five years to 2035, although the target that 80 percent of all new cars will be electric by 2030 remains in place.",positive,0.672707,0.20030183,0.12699117
Netherlands In 2023 the Dutch government adopted a €11.2 billion support package for energy costs.,positive,0.8082992,0.010601713,0.18109909
"Together with energy suppliers, it introduced a price cap against rising energy prices.",neutral,0.3282824,0.017225482,0.65449214
The energy sector established a €50 million emergency fund for the most vulnerable households.,positive,0.6672191,0.04663418,0.28614676
"The aim is to enable 165,000 such households to pay their energy bills.",neutral,0.32373458,0.009837544,0.6664279
It was announced that the 2024 budget foresees no general price increases for 2024.,neutral,0.24156985,0.05004756,0.7083826
"After the cabinet’s resignation in the summer and the elections held in late November 2023, the focus is on forming a new government.",neutral,0.046346426,0.0879839,0.8656696
