sentence,sentiment,positive_score,negative_score,neutral_score
Combined Group Management Report Contents Search Back → About this Report → Corporate Profile → Climate Protection and Environmental Management → Employees and Society → Governance → Sustainable Finance → Business Report → Forecast Report → Risks and Chances Report → Internal Control System → Disclosures Regarding Takeovers 36 E.ON SE Financial Statements 2023 Specific Actions GRI 404-2 Flexible work arrangements have been part of E.ON’s corporate culture for many years.,neutral,0.027619611,0.032390248,0.9399901
"In view of the Covid-19 pandemic, E.ON established hybrid work as a Group-wide standard.",neutral,0.15529312,0.0073758313,0.837331
We did this to make working at E.ON even more attractive and to position our Company as a modern employer in the future as well.,positive,0.8234621,0.007404387,0.1691335
Employees at E.ON companies based in Germany can take a workation.,neutral,0.02297018,0.15893139,0.8180984
The aim is to give them additional options to make where they work more flexible.,neutral,0.25601387,0.008528472,0.73545766
"In a workation, employees may— to the degree operationally possible and in conformity with agreed-on framework arrangements — temporarily perform their work from an EU country other than the one of their contractual workplace.",neutral,0.027614223,0.045553215,0.9268326
The aim is to make working at E.ON even more flexible and to respond even more individually to employees’ needs.,neutral,0.2934426,0.009434598,0.69712275
E.ON offers its employees benefits in addition to their contractual compensation.,neutral,0.06662859,0.04157565,0.89179575
"In addition to the benefits of the Company pension scheme or employer-financed accident insurance, E.ON supports its employees in non-work-related situations or in special life situations, such as when a family member falls ill. Employees in Germany, for example, can take advantage of various services provided or arranged by the Company.",neutral,0.034138706,0.025276897,0.9405844
These services range from stress and addiction counseling to support in caring for elderly or sick relatives.,neutral,0.06842524,0.018569771,0.91300505
Employees who fall ill for more than six weeks within a 12-month period receive help with reintegration.,negative,0.05210448,0.74964297,0.19825259
In granting these benefits no distinction is made between full-time and part-time employment.,neutral,0.031352352,0.068874724,0.8997729
Training and development are very important for E.ON’s attractiveness as an employer and pivotal for E.ON’s transformation into a learning organization.,positive,0.6177654,0.008418913,0.37381566
"All employees receive training at their onboarding, HSE training, and functional training relevant to their role, as well as soft-skills training and access to talent and leadership development programs.",neutral,0.1172006,0.009645803,0.87315357
"These include many digital, self-directed learning opportunities that employees can access from anywhere at any time.",neutral,0.07832061,0.010762726,0.9109167
"In addition to Group-wide training opportunities, the units have standardized digital learning offerings.",neutral,0.115804255,0.009112159,0.87508357
E.ON offers them for onboarding new employees and in part for training strategically important topics like digitalization or health and safety.,neutral,0.14963448,0.007860594,0.84250486
"To simplify their learning, employees can take learning journeys on specific specialist topics.",neutral,0.049629036,0.014931867,0.9354391
The journeys are offered by the central HR function’s People Development team and the central IT function’s Digital Empowerment team.,neutral,0.08387452,0.009635098,0.90649045
"Currently, each department is conducting projects to develop strategically important learning content.",neutral,0.18786599,0.008480241,0.8036538
This involves identifying critical skills and learning needs in line with E.ON’s strategy and external market requirements.,neutral,0.29453623,0.0075527295,0.697911
"During the year under review, for example, we identified which core competencies our employees need in which areas to continue managing our digital transformation.",neutral,0.23042257,0.009107206,0.76047015
We will subsequently offer department-specific learning opportunities so that we can develop the necessary skills in-house.,positive,0.7147176,0.0073295967,0.27795276
We are currently designing a new process for competence and skills management.,neutral,0.13843377,0.00932277,0.8522434
"We want to use it to automatically identify future-critical skills based on market trends; the process will also draw on new digital functionalities to continuously identify missing skills and learning needs for specialist departments, managers, and employees.",neutral,0.15336834,0.011432596,0.8351991
The basis for this is an E.ON-wide standardized skill taxonomy.,neutral,0.05203789,0.01612257,0.9318396
It is managed centrally and continually refined in collaboration with specialist departments.,neutral,0.08794394,0.010844592,0.9012115
E.ON believes that the most effective way for employees to learn is through experience and practice.,neutral,0.17042255,0.011505432,0.818072
"The Company adopts a 70-20- 10 learning approach: 70 percent of learning happens on the job, 20 percent through social interaction and knowledge sharing with others, and 10 percent by means of programs such as eLearning, seminars, and formal training.",neutral,0.0649473,0.014372275,0.9206804
E.ON keeps up with the faster pace of the digital age by increasingly replacing long formats with short digital learning formats and self-directed learning.,neutral,0.20189975,0.009438874,0.7886614
"It is part of employees’ workflow, it is tailored to their individual needs as much as possible, and it is accessible anytime and anywhere.",neutral,0.05493314,0.0135371685,0.93152976
In 2023 E.ON established a one-stop shop for all learning content in order to make learning opportunities for employees even more attractive and easier.,neutral,0.34831706,0.008180936,0.643502
This digital platform will combine all E.ON- wide learning opportunities in a single place and improve user- friendliness.,positive,0.6641683,0.008340278,0.32749137
"In addition, E.ON drew up a catalog of learning and development measures by the end of 2022 in order to achieve the goal of becoming a learning organization in the coming years.",neutral,0.34818342,0.008639098,0.64317745
"It ensures a Group-wide, new framework for learning and employee development and was introduced in all units with initial measures in 2023.",neutral,0.21070118,0.0075691137,0.7817297
"In the coming years, this will be accompanied by an ongoing internal communication campaign, such as the three- week Learning Weeks in September 2023 and a Fail and Learn video series with managers.",neutral,0.0854121,0.01610614,0.8984817
The Learning Weeks took place throughout the Group as an online format.,neutral,0.026092678,0.027582662,0.94632465
"In this context, 72 events were held and over 9,000 employees took part.",neutral,0.04515601,0.020458631,0.93438536
"E.ON helps people launch their careers by offering apprenticeships for various vocations as well as internships, working student activities, and other programs.",neutral,0.109782256,0.010726066,0.8794916
"Our offerings in Germany include local initiatives to help interested people start their careers with the help of school projects, internships, courses, and expert guidance.",neutral,0.24252604,0.0077992133,0.74967474
We also employ working students who can gain work experience at E.ON and simultaneously finance their education.,neutral,0.1759873,0.00963108,0.8143816
"In 2022 we also launched a new, Group-wide E.ON International Graduate Program (“EIGP”) to develop next-generation talent personally and professionally and to retain them at E.ON.",neutral,0.4896062,0.0075726346,0.50282115
"Cross- functional, national, and international assignments enable participants to get to know our business and network Group-wide.",neutral,0.22313443,0.007647697,0.7692178
"We support them with mentoring, coaching, and training.",neutral,0.216778,0.008785861,0.7744362
The trainees also work on a joint business project.,neutral,0.04637281,0.018488994,0.9351382
In 2023 the project involved having trainees conduct a survey to ascertain employees’ attitudes towards E.ON’s sustainability culture and thus provide important impetus for its evolution.,neutral,0.32789862,0.0078804465,0.6642209
"In 2023 the EIGP was expanded to include specialist tracks for Customer Solutions, Digital, Finance, and Energy Networks.",neutral,0.35085255,0.007517357,0.6416301
Entrants in 2023 consisted of 22 university graduates of nine different nationalities.,neutral,0.06391947,0.014808054,0.9212725
"Of these, 14 are in the generalist track and 8 Combined Group Management Report Contents Search Back → About this Report → Corporate Profile → Climate Protection and Environmental Management → Employees and Society → Governance → Sustainable Finance → Business Report → Forecast Report → Risks and Chances Report → Internal Control System → Disclosures Regarding Takeovers 37 E.ON SE Financial Statements 2023 in the specialist track.",neutral,0.0198667,0.033550594,0.9465827
A total of 37 participants are currently completing the EIGP.,neutral,0.08366063,0.0137249315,0.9026144
Goals and Performance Review We support our predominantly decentralized HR organization on issues of Group-wide significance or Group-wide value propositions.,neutral,0.13041836,0.009638687,0.859943
This includes setting central targets for topics with a Group-wide value proposition.,neutral,0.07686967,0.012316773,0.9108135
"The HR Board-which consists of the Senior Vice President (“SVP”) Group HR and representatives of the local HR organizations— defines, prioritizes, and decides on the specific annual HR targets for the implementation of Group-wide value propositions and their measurement criteria.",neutral,0.035129685,0.018618478,0.94625187
The targets will be reviewed periodically based on the previously defined measurement criteria.,neutral,0.043145288,0.020192483,0.9366622
E.ON wants to retain its people (and their expertise) and enable them to grow professionally.,positive,0.7711561,0.006478605,0.22236532
One of E.ON’s objectives is therefore also to fill management positions internally.,neutral,0.10604801,0.010134898,0.88381714
"At talent boards, E.ON’s HR representatives use a special tool to assess how many candidates have participated in an application process and who ultimately filled a vacant position.",neutral,0.037734844,0.1208526,0.84141254
It also enables E.ON to monitor whether selected candidates come from its own development pool and whether they meet its diversity targets.,neutral,0.13424134,0.0077612866,0.8579974
"E.ON’s talent boards not only focus on identifying talent and planning succession, but, since 2021, also on diversity aspects.",neutral,0.051928546,0.011994469,0.936077
The objective is in part to increase the proportion of women and employees from underrepresented groups among managers.,positive,0.8688394,0.00733343,0.12382717
"That is why, since 2020, E.ON has been strengthening its commitment and has made diversity a People Priority in GPS@E.ON, its HR strategy.",positive,0.88353616,0.007694949,0.10876882
Our talent strategy in 2023 focused on a more inclusive and flexible approach in order to enhance diversity in talent management as well.,positive,0.80737114,0.006867548,0.18576133
"To support this, we piloted a smart digital platform called My Career Hub in 2023 as well.",neutral,0.37522128,0.0076547773,0.61712396
"The platform suggests opportunities to employees that match their skills, interests, and ambitions.",neutral,0.29578316,0.007865829,0.69635105
"Examples include suitable jobs, mentoring opportunities, and project assignments.",neutral,0.09798543,0.018137552,0.88387704
"E.ON has conducted an annual employee survey since 2014 to find out how its people feel about their job, their supervisor, the work atmosphere in their unit, and other topics.",neutral,0.0337576,0.08883264,0.8774098
The periodic finetuning of our survey approaches led to the decision to implement a Group-wide employee engagement strategy (YourVoice@E.ON) in 2023.,neutral,0.438064,0.010650611,0.5512853
Engagement takes into account a large number of different factors that together contribute to an engagement score.,neutral,0.052328795,0.018284246,0.929387
"A high score, for example, indicates a high level of employee well-being and a lower risk of fluctuation.",positive,0.5622911,0.059160534,0.37854838
A characteristic feature of the new strategy is that employee feedback is recorded and evaluated more regularly.,neutral,0.08076245,0.016623376,0.9026142
"This will enable organizational units such as departments and individual teams to identify engagement issues swiftly and independently, to discuss them as a team, and to have the opportunity to initiate improvements together.",neutral,0.2545613,0.009259665,0.736179
"Following the gradual implementation of YourVoice@E.ON, it will be the central approach to employee surveys in the E.ON Group, supplemented only selectively by specific, concise surveys on certain topics.",neutral,0.061433744,0.011863977,0.92670226
"The centerpiece of the new YourVoice@E.ON approach is a technology platform that, at certain intervals, emails employees questions that address aspects of well-being and the current work situation.",neutral,0.06469507,0.01414328,0.9211616
Answering the questions is anonymous and voluntary and can be integrated into everyday work with little effort.,neutral,0.023841016,0.06722343,0.90893555
"Managers can access the findings of this ongoing feedback on their dashboards at any time, react to individual aspects or trends, and work with their teams on improvements.",neutral,0.12587854,0.00977269,0.8643488
This makes YourVoice@E.ON more than a traditional employee survey and supports our feedback culture.,positive,0.59045637,0.0097267935,0.39981687
› We conducted our periodic survey of Employee Net Promoter Score (“eNPS”) in 2023 as well.,neutral,0.10043248,0.022536011,0.8770315
eNPS measures employees’ willingness to recommend E.ON as an employer.,neutral,0.11980734,0.026375415,0.8538173
"In the 2023 survey, eNPS improved by eight points (+36).",positive,0.95789045,0.021769729,0.020339724
"‹ Combined Group Management Report Contents Search Back → About this Report → Corporate Profile → Climate Protection and Environmental Management → Employees and Society → Governance → Sustainable Finance → Business Report → Forecast Report → Risks and Chances Report → Internal Control System → Disclosures Regarding Takeovers 38 E.ON SE Financial Statements 2023 Progress and Measures GRI 2-7 Employees: Core Workforce1 FTE 2023 2022 2021 Energy Networks 39,456 38,542 38,032 Customer Solutions 26,849 25,046 26,067 Corporate Functions/Other 5,937 5,790 5,634 E.ON Group 72,242 69,378 69,733 1Core workforce includes board members and managing directors but excludes apprentices, interns, and working students.",neutral,0.016256487,0.051277537,0.93246603
"At year-end 2023, the E.ON Group’s core workforce had 72,242 employees.",neutral,0.028808167,0.044124357,0.92706746
This figure includes part-time positions on a pro rata basis.,neutral,0.018438619,0.04651674,0.93504465
"The number of employees increased— by 2,864 FTEs, or 4 percent— in 2023.",positive,0.9434902,0.01915817,0.037351683
"The proportion of employees working outside Germany (34,715 FTEs) decreased slightly to 48 percent compared with year-end 2022 (49 percent).",negative,0.011891295,0.9698953,0.018213337
The number of employees at Energy Networks increased.,positive,0.9057335,0.018409781,0.07585673
"This was mainly attributable to the implementation of our growth strategy, associated network expansion, network modernization and digitalization.",neutral,0.20075859,0.008763335,0.790478
The deconsolidation of the VSEH Group in Slovakia had a countervailing effect.,neutral,0.40767443,0.14181066,0.45051488
Customer Solutions’ core workforce increased as well.,positive,0.95437,0.013234783,0.032395177
This was mainly due to capacity expansion to meet increased customer requirements and to roll out smart energy meters in the United Kingdom.,positive,0.9073806,0.0070636077,0.0855558
"There was also significantly more growth-driven new hiring in most of the other countries, in particular the Netherlands, Germany, and Hungary.",positive,0.86718524,0.06851106,0.064303756
The deconsolidation of the VSEH Group in Slovakia had a countervailing effect at Customer Solutions as well.,positive,0.4125423,0.290319,0.2971387
"The number of employees at Corporate Functions/Other rose year on year as well, mainly because of hiring and incourcing of digitalization and IT support capabilities.",positive,0.9548867,0.02405506,0.021058224
"By contrast, the number of employees at PreussenElektra declined owing to the dismantling of its nuclear power plants.",negative,0.046656735,0.9306801,0.022663057
"Core Workforce by Country1 Headcount FTE Dec. 31, 2023 Dec. 31, 2022 Dec. 31, 2023 Dec. 31, 2022 Germany 38,945 36,549 37,526 35,194 United Kingdom 9,742 8,769 9,420 8,437 Romania 7,028 6,916 6,861 6,759 Hungary 6,035 5,745 6,009 5,726 Czech Republic 3,271 3,201 3,250 3,178 The Netherlands 3,438 2,955 3,075 2,666 Sweden 2,607 2,432 2,580 2,414 Poland 1,890 1,873 1,879 1,861 Slovakia2 – 1,589 – 1,578 Other 1,662 1,584 1,642 1,565 E.ON Group 74,618 71,613 72,242 69,378 1 Core workforce includes board members and managing directors but excludes apprentices, interns, and working students.",neutral,0.016508179,0.07038049,0.9131114
2 The company VSEH operating in Slovakia was deconsolidated in the end of 2023.,neutral,0.020769965,0.04592685,0.9333031
"Combined Group Management Report Contents Search Back → About this Report → Corporate Profile → Climate Protection and Environmental Management → Employees and Society → Governance → Sustainable Finance → Business Report → Forecast Report → Risks and Chances Report → Internal Control System → Disclosures Regarding Takeovers 39 E.ON SE Financial Statements 2023 At the end of the year, E.ON had a total of 2,365 apprentices in Germany.",neutral,0.018031321,0.042393412,0.93957525
This corresponds to an apprenticeship ratio of 5.6 percent.,neutral,0.12945496,0.021361643,0.8491834
"Of the 587 apprentices who completed their training in 2023, 538 were given a permanent or temporary employment contract.",negative,0.081315376,0.6920899,0.22659478
"This is a very high takeover rate of 92 percent (2022: 553 of 598, or 93 percent).",neutral,0.06953919,0.025951104,0.9045098
A consistently high takeover rate of apprentices is one of the ways E.ON is actively addressing the shortage of skilled workers.,positive,0.45110792,0.1796385,0.36925355
"Workforce Age Distribution GRI 405-1 At year-end 2023, the average age of E.ON employees was 42, as in the previous year.",negative,0.02382762,0.65121216,0.32496017
This is comparable with the average age at other DAX 40 companies.,neutral,0.095821075,0.023832962,0.88034594
The age distribution of E.ON’s workforce reflects the demographic trend of working-age people.,neutral,0.04114097,0.039244212,0.91961485
"In 2023 around 22 percent of our employees were under the age of 31, 49 percent between 31 and 50, and around 29 percent older than 50.",neutral,0.027300803,0.16687442,0.8058247
"New Employee Hires and Turnover Rate GRI 401-1 E.ON hired 11,308 new employees in the year under review.",negative,0.037222162,0.7829442,0.17983373
"This too reflects the systematic implementation of our strategy focusing on growth, sustainability, and digitalization.",neutral,0.46273705,0.008326229,0.52893674
The voluntary turnover rate in 2023 was 4.6 percent (2022: 6.1).,neutral,0.03609292,0.41677094,0.5471361
"Customer Satisfaction  GRI 3-3 Customers of all types— households and businesses, cities and government entities— understand that a digital and decarbonized future means that they will not only consume, but also increasingly make and store their own clean energy.",neutral,0.20457534,0.008640547,0.7867841
These customers are extremely knowledgeable and discerning.,neutral,0.2473707,0.0083558895,0.7442734
"They expect E.ON not only to listen to and anticipate their needs, but also to design innovative and sustainable energy solutions, deliver best-in-class services, and provide a consistently good customer experience.",positive,0.8305724,0.007006495,0.1624211
Earning and retaining their trust and loyalty is very significant for us to sustainably grow our business.,positive,0.83461994,0.0076386896,0.15774141
"Loyal customers tend to stay with us longer, to purchase additional products and services, and to recommend us to their family and friends.",neutral,0.27479365,0.011136627,0.7140698
"2023, too, was a difficult year for our customers: energy prices remained at a high level, which was only partially mitigated by government subsidy programs.",negative,0.027838046,0.9324738,0.03968822
"In some markets E.ON was the Apprentices in Germany Headcount Percentages 2023 2022 2021 2023 2022 2021 Energy Networks 2,208 2,037 2,064 7.3 7.2 7.4 Customer Solutions 72 67 65 1.1 1.1 1.0 Corporate Functions/Other 85 109 179 1.6 2.1 3.4 E.ON Group 2,365 2,213 2,308 5.6 5.6 5.8 Combined Group Management Report Contents Search Back → About this Report → Corporate Profile → Climate Protection and Environmental Management → Employees and Society → Governance → Sustainable Finance → Business Report → Forecast Report → Risks and Chances Report → Internal Control System → Disclosures Regarding Takeovers 40 E.ON SE Financial Statements 2023 first supplier to lower its prices below the government-mandated price cap, such as in the Czech Republic.",neutral,0.032022245,0.10914934,0.85882837
E.ON companies made customers aware of support opportunities by including information about alternative tariffs and government subsidy programs in their bills.,neutral,0.26166773,0.009072444,0.72925985
"In addition, customers could use special apps and other tools to better understand their electricity consumption and ways to conserve energy.",neutral,0.1719403,0.008403978,0.8196557
"E.ON’s Approach E.ON continually measures and improves the experience we offer to our customers, in order to retain— and, ideally, deepen— their loyalty.",positive,0.8628431,0.0070611564,0.13009576
It is essential for us to be systematically customer-centric.,neutral,0.1712049,0.009560799,0.8192343
"The E.ON brand promises to give our customers what they want in the future energy world: consistently positive experiences with our services and smart, sustainable solutions.",positive,0.84000546,0.0068309936,0.1531635
E.ON transports energy from where it is produced to where it is needed.,neutral,0.03797746,0.01719453,0.944828
"We also work to empower people, companies, and cities across Europe to create the sustainable world that they want to live in.",neutral,0.34063587,0.009272053,0.65009207
The purpose is to build energy communities in which everyone can do their part and meet these needs— from a household opting for green electricity to an entire city committing to sustainability.,neutral,0.21940795,0.008968007,0.771624
Delivering on this promise will make the E.ON brand distinctive and enable us to successfully expand our business.,positive,0.92313385,0.00844815,0.06841803
E.ON’s objective is to become the number one energy-solutions company in all of its markets and thus to live up to its ambition of being the leading company of the energy transition.,positive,0.8887168,0.007355242,0.10392798
In 2023 E.ON revised its market positioning to underscore its leading role in the energy transition.,positive,0.8306103,0.014136676,0.15525304
"As part of this process, we surveyed customers and consumers about what characteristics they think such a company should have.",neutral,0.085010245,0.013722862,0.9012669
"They told us that it should have the necessary size and market strength and above all 1 This can involve multiple interactions within a process such as a move, or multiple contacts from an existing or potential customer with the same request, for example via the chatbot.",neutral,0.038719155,0.023421453,0.93785936
technical innovativeness and a vision of the future energy world.,neutral,0.34446582,0.008612581,0.64692163
All this was accompanied by a desire for reliability and stability.,neutral,0.13960633,0.023759203,0.8366345
"Organization and Responsibilities The Chief Executive Officer (“CEO”) coordinates, from Corporate Functions, our brand and marketing strategy with the aim of further developing and strengthening the E.ON brand.",neutral,0.19066402,0.0073712044,0.8019648
The Chief Operating Office— Commercial (“COO— C”) supports the sales and energy solutions business for all customer segments and in all E.ON markets.,neutral,0.09075368,0.00882652,0.9004198
The regional units’ Customer Experience teams are responsible for customer satisfaction.,neutral,0.03199245,0.025536215,0.9424714
They carry out projects and measures in their respective sales territories and exchange information on successful approaches and progress on a monthly basis.,neutral,0.036401678,0.01521586,0.9483825
"There are Customer Experience teams in Germany, the United Kingdom, Italy, Romania, Sweden, the Czech Republic, Hungary, Poland, and the Netherlands.",neutral,0.05757019,0.01318267,0.9292472
