sentence,sentiment,positive_score,negative_score,neutral_score
" E.ON SE Financial Statements pursuant to German GAAP and Combined Group Management Report for the 2023 Financial Year Contents Search Back 1 E.ON SE Financial Statements 2023 Corporate Profile 4 Business Model 4 ESG Materiality and Stakeholder Engagement 4 Strategy 7 Innovation 11 Management Control System 13 Climate Protection and Environmental Management 15 Climate Protection 15 Environmental Management 22 Sustainable Products and Services 27 Employees and Society 30 Occupational Health and Safety 30 Working Conditions and Employee Development 34 Customer Satisfaction 39 Security of Supply 41 Community Involvement 44 Data Protection, Cybersecurity, and Product Safety 45 Business Resilience Management 47 Governance 49 Compliance and Anticorruption 49 Energy Affordability 51 Diversity and Inclusion 53 Human Rights and Supply Chain Management 55 Tax 58 Sustainable Finance and Investment 60 EU Taxonomy 60 Sustainable Finance 68 ESG Ratings of E.ON 68 ESG Asset Management and Pension Assets 68 Business Report 69 Macroeconomic and Industry Environment 69 Special Events in the Reporting Period 74 Subsequent Events 75 Business Performance 76 Energy Networks 77 Customer Solutions 78 Earnings Situation 80 Financial Situation 86 Asset Situation 90 E.ON SE’s Earnings, Financial, and Asset Situation 91 Forecast Report 93 Risks and Chances Report 95 Disclosures Pursuant to Section 289, Paragraph 4, and Section 315, Paragraph 4 of the German Commercial Code on the Internal Control System for the Accounting Process 103 Disclosures Pursuant to Section 289a and Section 315a of the German Commercial Code and Explanatory Report 106 Combined Group Mana gement Report Combined Group Management Report Contents Search Back → About this Report → Corporate Profile → Climate Protection and Environmental Management → Employees and Society → Governance → Sustainable Finance → Business Report → Forecast Report → Risks and Chances Report → Internal Control System → Disclosures Regarding Takeovers 2 E.ON SE Financial Statements 2023 About This Report GRI 2-2, GRI 2-3, GRI 2-4, GRI 2-5, GRI 2-6 For the 2023 reporting year, E.ON has again published an Integrated Annual Report that combines financial and non- financial reporting.",neutral,0.03820308,0.021858241,0.9399387
The reason is that sustainability is the centerpiece of E.ON’s strategy and— in every dimension— the standard for our actions.,neutral,0.13561495,0.009594786,0.85479033
"An integrated report provides our stakeholders with a holistic and transparent view of our financial, environmental, and social performance.",neutral,0.42839304,0.008018369,0.5635887
Standards This Integrated Annual Report applies to the E.ON Group as well as E.ON SE.,neutral,0.03490553,0.01675973,0.94833475
"E.ON is therefore fulfilling all requirements of International Financial Reporting Standards (“IFRS”), the German Commercial Code (German abbreviation: “HGB”), and German Accounting Standards (German abbreviation “DRS”).",neutral,0.14333017,0.00871663,0.84795326
The combined Non-Financial Statement (“NFS”) pursuant to Sections 315b and 315c in conjunction with Sections 289b to 289e of the HGB is fully integrated into the Combined Group Management Report.,neutral,0.034427118,0.019142402,0.9464305
"The Group Management Report thus contains information on five aspects: the environment, employees, social matters, human rights, as well as anti-corruption and anti-bribery.",neutral,0.030421883,0.021888038,0.9476901
The NFS also complies with the disclosure requirements of the EU Taxonomy Regulation.,neutral,0.06277413,0.014693895,0.92253196
The Non-Financial Statement (“NFS”) Index indicates where these disclosures can be found in the Integrated Annual Report.,neutral,0.018318737,0.039846353,0.9418349
"In addition, the Disclosures Regarding Takeovers chapter is integrated into the Annual Report.",neutral,0.032545835,0.018309837,0.94914436
"E.ON’s sustainability reporting, which consists of the NFS and other sustainability disclosures, is guided by the findings of its materiality analysis and topics relevant for stakeholders.",neutral,0.04948762,0.012551825,0.93796057
It has been prepared with reference to the GRI Standards 2021 by the Global Reporting Initiative.,neutral,0.062779225,0.011279505,0.92594135
The GRI standards covered by the content of a chapter are displayed on the first page of the chapter.,neutral,0.017581452,0.03471356,0.94770503
The GRI Index provides an overview.,neutral,0.02944502,0.029063908,0.94149107
The Other Information chapter contains E.ON’s disclosures regarding the Electric Utilities and Power Generators Standards issued by the Sustainability Accounting Standards Board (“SASB”).,neutral,0.027070252,0.023391519,0.94953823
E.ON is committed to the ten principles of the United Nations Global Compact (“UNGC”) and supports the United Nations Sustainable Development Goals (“SDGs”).,neutral,0.1780094,0.008106644,0.8138839
We describe our contributions to the SDGs in the Strategy chapter.,neutral,0.109345354,0.009284831,0.88136977
"Our climate-related reporting, which is based on the recommendations of the Task Force on Climate-related Financial Disclosures (“TCFD”) as well, can be found in the chapter Climate Protection.",neutral,0.04175554,0.017503986,0.94074047
Scope This report encompasses all subsidiaries that are fully consolidated in E.ON’s Consolidated Financial Statements 2023.,neutral,0.024170455,0.022523241,0.95330626
Any deviations are marked accordingly.,neutral,0.025648933,0.090542465,0.8838087
KPI-based thresholds are used to distinguish companies that do not contribute significantly to the report.,neutral,0.035211742,0.022374097,0.9424142
"The next chapter, Business Model , contains more information about the E.ON Group’s structure and business segments.",neutral,0.02685106,0.02241149,0.9507375
The reporting period is the 2023 calendar year.,neutral,0.015426782,0.073087916,0.9114853
For most KPIs the corresponding prior-year figure is provided to improve comparability.,neutral,0.13307124,0.011847436,0.8550814
Adjustments to prior-year figures of a KPI are explained in footnotes.,neutral,0.017909558,0.053424295,0.9286662
Statements on the future development of E.ON and its subsidiaries are estimates based on information available at the time of reporting.,neutral,0.022017747,0.02494234,0.95303994
Actual results may deviate from these statements.,negative,0.020064482,0.7147546,0.26518086
The Corporate Governance Declaration is published on our website eon.com in the section Corporate Governance.,neutral,0.027042361,0.019807003,0.95315063
"The Integrated Annual Report was published on March 13, 2024, and is available in German and English in pdf format.",neutral,0.027324049,0.018573321,0.95410264
You can download the pdf version of this report at eon.com .,neutral,0.030363722,0.022087855,0.9475484
The previous Integrated Annual Report was published in March 2023.,neutral,0.020753484,0.04034717,0.9388993
You can find it and additional reports in the investor relations archive.,neutral,0.024497759,0.029398128,0.94610405
"Language To improve readability, we generally use the shorter name for companies and organizations (such as “E.ON” rather than “E.ON SE”).",neutral,0.040997483,0.01833308,0.9406695
"Sustainability Ratings E.ON’s commitment to transparency includes subjecting its sustainability performance to independent, detailed assessments by specialized agencies and capital-market analysts.",neutral,0.14324275,0.008253701,0.84850353
The findings of these assessments provide important guidance to investors and to E.ON.,neutral,0.22049017,0.0077246586,0.7717852
They help us identify our strengths and weaknesses and further improve our performance.,positive,0.90362567,0.008739333,0.08763503
The Sustainable Finance chapter presents the results of sustainability ratings.,neutral,0.033911005,0.019820718,0.9462683
Combined Group Management Report Contents Search Back → About this Report → Corporate Profile → Climate Protection and Environmental Management → Employees and Society → Governance → Sustainable Finance → Business Report → Forecast Report → Risks and Chances Report → Internal Control System → Disclosures Regarding Takeovers 3 E.ON SE Financial Statements 2023 Assurance The Combined Group Management Report is generally audited as part of the statutory audit of the financial statements.,neutral,0.021916948,0.02586617,0.95221686
"Content that is not part of the statutory audit of the Consolidated Financial Statements and is therefore excluded from the auditor’s report is identified separately, as described below.",neutral,0.016808229,0.05999598,0.92319584
"For the NFS and selected additional sustainability information, a separate assurance engagement (“Sustainability Assurance”) was also performed by KPMG AG in accordance with the International Standard on Assurance Engagements (“ISAE”) 3000 (Revised) issued by the International Auditing and Assurance Standards Board (“IAASB”).",neutral,0.041810747,0.0145860445,0.9436032
The audit assurance applied to the different contents is clarified in the report by means of various symbols.,neutral,0.026001716,0.026088763,0.94790953
Symbols next to headings [H2] apply until the next heading of the same level of hierarchy.,neutral,0.015985148,0.074154,0.9098609
Sections within the same chapter that were audited with a different assurance may be marked separately.,neutral,0.018482793,0.04503118,0.936486
This is done in longer sections by means of symbols next to the subheadings [H3] which apply until the next heading of the same level of hierarchy.,neutral,0.01807865,0.042085122,0.93983626
"In addition, individual sections or KPIs that are subject to a different audit assurance may be marked separately.",neutral,0.019319437,0.037401166,0.9432794
"The corresponding contents are marked as follows:  Not part of the statutory audit, audited with reasonable assurance as part of the Sustainability Assurance in accordance with ISAE 3000.",neutral,0.043616053,0.013171136,0.94321275
" Not part of the statutory audit, audited with limited assurance as part of the Sustainability Assurance in accordance with ISAE 3000; individual text passages are indicated by ►◄.",neutral,0.03106379,0.017264508,0.95167166
" Not part of the statutory audit, unaudited; individual text passages are indicated by › ‹.",neutral,0.016207132,0.037453663,0.9463392
"Prior-year figures and quantified changes from the prior year included in sections marked as audited are, in principle, audited with the same degree of assurance as for the 2023 reporting year.",neutral,0.055937573,0.017078053,0.92698437
Figures for 2021 were audited with limited assurance.,neutral,0.035548147,0.062330674,0.9021211
"The precise scope of the audit is described in the Other Information section in the Independent Auditor’s Report and in the report on the management review of sustainability information.Combined Group Management Report Contents Search Back → About this Report → Corporate Profile → Climate Protection and Environmental Management → Employees and Society → Governance → Sustainable Finance → Business Report → Forecast Report → Risks and Chances Report → Internal Control System → Disclosures Regarding Takeovers 4 E.ON SE Financial Statements 2023 Corporate Profile Business Model E.ON is an investor-owned energy company with approximately 74,600 employees led by Corporate Functions in Essen.",neutral,0.028680526,0.02108977,0.9502297
The Group’s core business is divided into two segments: Energy Networks and Customer Solutions.,neutral,0.043254144,0.013610439,0.94313544
"Corporate functions, equity interests managed directly by E.ON SE, and non-strategic operations are reported under Corporate Functions/Other.",neutral,0.016987953,0.031893685,0.95111835
Corporate Functions Corporate Functions’ main task is to lead the E.ON Group.,neutral,0.025152888,0.02329302,0.9515541
This involves charting E.ON’s strategic course and managing and funding its existing business portfolio.,neutral,0.12632151,0.007934309,0.86574423
"Corporate Functions’ tasks include optimizing E.ON’s overall business across countries and markets from a financial, strategic, and risk perspective, conducting stakeholder management, and managing E.ON Energy Markets GmbH (“E.ON Energy Markets”), the Company’s central commodity procurement unit.",neutral,0.045196414,0.013172705,0.94163084
"The E.ON Group’s non-strategic activities, such as the operation of nuclear power stations until April 15, 2023, and their dismantling (managed by the PreussenElektra unit) and the generation business in Turkey are reported here as well.",neutral,0.023684438,0.022691993,0.9536236
Energy Networks This segment consists of E.ON’s power and gas distribution networks and related activities.,neutral,0.03365295,0.01578044,0.95056665
"It is subdivided into three regional markets: Germany, Sweden, and East-Central Europe/Turkey (which consists of the Czech Republic, Hungary, Romania, Poland, Croatia, Slovakia, and the stake in Enerjisa Enerji in Turkey, which is accounted for using the equity method).",neutral,0.026407797,0.017428664,0.9561635
"This segment’s main tasks include operating its power and gas networks safely and reliably, carrying out all necessary maintenance and repairs, and expanding its power and gas networks, which frequently involves adding customer connections and the connection of renewable energy generation assets.",neutral,0.41968623,0.008987298,0.57132655
Customer Solutions This segment serves as the platform for working with E.ON’s customers to actively shape Europe’s energy transition.,neutral,0.269563,0.006733971,0.723703
"This includes supplying customers in Europe (excluding Turkey) with power, gas, and heat, and providing them with solutions that enhance their energy efficiency, energy autonomy, and eMobility.",positive,0.7067032,0.0073634223,0.28593343
"E.ON’s activities are tailored to the individual needs of customers across all categories: residential, small and medium-sized enterprises, large commercial and industrial, sales partners, and public entities.",neutral,0.07037766,0.010216179,0.91940624
"The E.ON Group’s main presence in this business is in Germany, the United Kingdom, the Netherlands, Nordics (for example, Sweden, Denmark, and Norway), Italy, the Czech Republic, Hungary, Croatia, Romania, Poland, and Slovakia.",neutral,0.04487827,0.012714582,0.94240713
"In addition, Energy Infrastructure Solutions engages in activities aimed at decarbonizing commercial customers, cities, and communities, such as sustainable city solutions and district heating.",neutral,0.09116766,0.010262837,0.89856946
"Significant Changes to the Business Model Effective January 1, 2024 Some of the Energy Network segment's regional markets were reclassified effective January 1, 2024.",neutral,0.026069216,0.033767764,0.94016296
"East-Central Europe/Turkey is now divided into East-Central Europe (which includes the Czech Republic, Slovakia, and Poland) and Southeastern Europe (which includes Hungary, Croatia, Romania, and our stake in Enerjisa Enerji in Turkey, which is accounted for using the equity method).",neutral,0.031031089,0.014818199,0.95415074
"In addition, the Customer Solutions segment was renamed Energy Retail.",neutral,0.04383987,0.021176256,0.93498385
"Furthermore, the Energy Infrastructure Solutions (""EIS"") was transferred from Energy Retail and has been an independent segment since January 1, 2024.",neutral,0.039114047,0.014504921,0.94638103
We thus now report on its activities separately.,neutral,0.0256519,0.017292285,0.95705587
"Furthermore, the E.ON Group's central commodity procurement unit, E.ON Energy Markets, is reported at Energy Retail effective January 1, 2024.",neutral,0.0190836,0.025608238,0.9553082
"It was part of Corporate Functions/Other until December 31, 2023.",neutral,0.017549621,0.031205554,0.9512449
"ESG Materiality and Stakeholder Engagement  ESG Materiality GRI 3-1, GRI 3-2 E.ON has conducted an annual materiality analysis since 2006.",neutral,0.03844142,0.018170957,0.94338757
The purpose is to identify and evaluate the sustainability topics that are most important to the Company and its stakeholders.,neutral,0.13468017,0.008326339,0.8569935
This report contains information on the topics that the materiality analysis deemed to be particularly significant.,neutral,0.039373618,0.025791442,0.93483496
It also partially addresses less material sustainability topics.,neutral,0.036229495,0.017710596,0.9460599
"E.ON thus aims to meet the different expectations of stakeholders as well as the requirements of environmental, social, and governance (“ESG”) rankings and ratings.",neutral,0.122704685,0.008063665,0.86923164
We provide an overview of the material and other topics in the Non-Financial Statement (“NFS”) Index.,neutral,0.03223456,0.021736138,0.94602925
Identification of Material Topics In 2023 E.ON conducted a materiality analysis in accordance with the requirements of the Non-Financial Reporting Directive (“NFRD”).,neutral,0.06605058,0.012428981,0.9215205
"The requirements of the Corporate Sustainability Reporting Directive (“CSRD”) were taken into account, but not applied.",neutral,0.04729212,0.015440906,0.937267
We applied the double materiality principle: we considered the financial perspective as well as the impact perspective.,neutral,0.035080608,0.021523438,0.943396
"The process had four steps, which are described below: Step One: Topic Identification and Collection E.ON first gathered information and evidence on potentially material topics.",neutral,0.03328615,0.018910205,0.9478036
"We consulted a variety of sources, including regulations, reporting standards as well as statements from customers, competitors, investors, and non-governmental organizations (“NGOs”).",neutral,0.041561853,0.01708218,0.941356
We used this to create an overview of possible material topics.,neutral,0.04799311,0.015211533,0.93679535
These were then compared with our existing material topics and collated.,neutral,0.032434296,0.0200774,0.94748837
The basis for this was an evaluation that correlates a topic’s frequency of mention to its importance for the industry.,neutral,0.08206854,0.014912089,0.9030194
"Experts from Sustainability, Group Accounting, and Investor Relations divisions reviewed and finally agreed on a short list of E.ON’s potentially material topics.",neutral,0.122442104,0.011873746,0.8656841
"Combined Group Management Report Contents Search Back → About this Report → Corporate Profile → Climate Protection and Environmental Management → Employees and Society → Governance → Sustainable Finance → Business Report → Forecast Report → Risks and Chances Report → Internal Control System → Disclosures Regarding Takeovers 5 E.ON SE Financial Statements 2023 Step Two: Impact Perspective E.ON analyzed the impact perspective by surveying NGOs, research institutes, suppliers, customers, and other stakeholders.",neutral,0.04795077,0.016655417,0.9353938
We gave them a questionnaire containing the topics identified in step one and asked them to rate them.,neutral,0.107099146,0.012519445,0.88038146
The questionnaire’s findings were then examined in greater depth in stakeholder interviews.,neutral,0.09492283,0.011725053,0.89335203
"Representatives from the Sustainability, Group Accounting, Investor Relations, and Group Risk functions evaluated the survey’s findings in a workshop, which concluded the impact analysis.",neutral,0.1341292,0.01934319,0.84652764
Step Three: Financial Perspective E.ON evaluated the financial perspective by examining the risks and opportunities associated with the ESG topics contained in its Enterprise Risk Management (“ERM”) system.,neutral,0.16128449,0.0098649375,0.8288506
"Another workshop, consisting of the same participants, was then held to assess and validate the financial materiality of the topics identified.",neutral,0.07010261,0.01445724,0.9154401
Step Four: Materiality Threshold E.ON finalized the list of topics by defining a common materiality threshold for the impact and financial perspectives.,neutral,0.049108356,0.014071796,0.93681985
Only topics that exceeded it were considered material.,neutral,0.032873336,0.034922406,0.9322043
"To determine them, we held a third workshop consisting of the above-mentioned participants.",neutral,0.052816097,0.018473236,0.9287107
"The findings were then presented to the Sustainability Council, which approved E.ON’s materiality analysis for 2023.",neutral,0.15244074,0.009385915,0.83817333
The council is chaired by the Chief Sustainability Officer.,neutral,0.027082494,0.02287376,0.95004374
He reports periodically to the E.ON Management Board on progress made.,neutral,0.06276099,0.015358248,0.9218808
Material Topics E.ON’s sustainability reporting for the 2023 reporting year must for the last time reflect NFRD requirements.,neutral,0.019650662,0.03640865,0.94394064
We therefore did not conduct a comprehensive update of our sustainability analysis pursuant to NFRD requirements.,neutral,0.03236151,0.03991284,0.9277257
"Instead, we conducted a Group- wide materiality analysis oriented toward the European Sustainability Reporting Standards 2 (“ESRS 2”) in order to prepare for our first reporting pursuant to the Corporate Sustainability Reporting Directive (“CSRD”) for the 2024 reporting year.",neutral,0.19410312,0.01064796,0.79524887
We integrated the approval of the update of our sustainability analysis pursuant to NFRD requirements from 2022 and assessed the prior year’s findings to ensure they are up to date.,positive,0.5742482,0.011055246,0.41469654
Our CEO Leonard Birnbaum and our CFO Marc Spieker performed the final validation.,neutral,0.09003805,0.018682333,0.89127964
"The findings of our NFRD materiality analysis for 2023, which are listed below, reaffirm the findings of the analysis from the prior year.",neutral,0.083548285,0.021378845,0.8950729
The highest relevance from a financial and impact perspective was assigned to the following three topics: • Climate-change mitigation • Energy affordability • Reliable energy supply The material topic of climate-change mitigation also encompasses customer solutions that mitigate climate change.,neutral,0.08553385,0.00953257,0.90493363
"Since both aspects— general climate-change mitigation and customer solutions that mitigate climate change— are extensive, they are presented in separate chapters in the Integrated Annual Report 2023.",neutral,0.053745594,0.01514429,0.93111014
The ESG chapters of this report provide information on E.ON’s approach to managing its material topics and outline the Company’s progress in the reporting year.,neutral,0.04968515,0.014192674,0.93612224
"The description of the management approach is based on GRI 3-3, Management of material topics.",neutral,0.025387807,0.02411754,0.9504947
"Stakeholder Engagement GRI 2-28, GRI 2-29 E.ON continually seeks dialogue with its various stakeholders.",neutral,0.48315236,0.008387616,0.5084601
We want to listen to and understand their points of view and also to talk to them openly about the potential short- and long-term impacts of our business activities.,neutral,0.15415397,0.009192191,0.83665377
"This is an important objective of our daily work at the local, national, and European level.",neutral,0.09539671,0.010839937,0.89376336
A stakeholder is any person who or any group that has an interest in a company.,neutral,0.022086008,0.029869558,0.9480444
Stakeholder engagement is thus a core process of E.ON’s corporate governance.,neutral,0.04444969,0.017711453,0.9378388
The dialogue formats we choose vary by stakeholder and topic.,neutral,0.027775532,0.0202812,0.9519433
They range from information campaigns and discussion forums with associations and NGOs to face-to-face discussions and lobbying.,neutral,0.03659772,0.020364553,0.9430377
"For example, E.ON is actively involved in the global investor initiative CDP (Carbon Disclosure Project), works with the United Nations Environment Programme (“UNEP”), and supports the UN Decade on Ecosystem Restoration.",neutral,0.23971699,0.0073966775,0.7528863
"Furthermore, since 2021 E.ON has been part of the LEAF Coalition (Lowering Emissions by Accelerating Forest Finance), which is committed to biodiversity and the protection of tropical forests.",neutral,0.29201624,0.008087529,0.6998963
More information on CDP and the LEAF Coalition can be found in the “Climate Protection” chapter.,neutral,0.043533947,0.015440595,0.9410255
"E.ON is also a member of SolarPower Europe, a European association of energy suppliers and solar companies.",neutral,0.098302886,0.0091622155,0.8925349
The Solar Stewardship Initiative (“SSI”) was set up as part of this association.,neutral,0.07228469,0.011512173,0.9162031
Its aim is to create more transparency for solar-power supply chains and to ensure compliance with human rights.,positive,0.4972323,0.01165784,0.49110985
E.ON actively participates in policy debates on issues that affect the Company.,neutral,0.101269394,0.01048806,0.88824254
"We use a variety of channels for this, including lobbying, media interviews with our executives, and their appearances as public speakers.",neutral,0.040003505,0.016677365,0.94331914
"In addition, policymakers and regulators frequently invite E.ON to provide its technical and energy expertise as part of their decision-making processes.",neutral,0.05335581,0.013985596,0.93265855
